{
  "schema_version": "gkr-m1-corpus-freeze-v1",
  "corpus_id": "gkr-m1-authority-corpus",
  "status": "frozen",
  "source_commit": "d308888",
  "corpus_contract": {
    "manifest_schema_version": "gkr-m1-corpus-manifest-v1",
    "authority_format_version": "gkr-m1-authority-jsonl-v1",
    "authority_schema": "gkr.schemas.KnowledgeRecord"
  },
  "stable_record_count": 47,
  "authority_event_count": 63,
  "authority_jsonl_sha256": "3325db848fe13a2f0f3e7b2e0894e92d9b27e99c42a16b3c90f03b40a39c81a2",
  "corpus_manifest_sha256": "0ff041af637fb8ff8c41814e8c63b40bab9f62bd99cbda70c827ceaba0abdf94",
  "content_digest_sha256": "1a30668d55910c544fa00aa6927ad7dc3064f6585a6186bc543fc590dec64300",
  "provenance": {
    "corpus_author": {
      "kind": "model_family",
      "identity": "grok"
    },
    "content_review": {
      "kind": "independent_model_family",
      "identity": "chatgpt",
      "verdict": "CONTENT_APPROVED"
    },
    "code_review": {
      "kind": "independent_model_family",
      "identity": "cursor",
      "verdict": "CODE_APPROVED"
    },
    "review_class": "ai_review_of_fictional_benchmark_content",
    "owner_approval": false,
    "note": "Grok authored the fictional corpus; independent ChatGPT content review concluded CONTENT_APPROVED; independent Cursor code review concluded CODE_APPROVED. That is AI review of fictional benchmark content, not human or owner approval, and it does not authorize production use or answer-quality claims."
  }
}
